[
  {
    "id": "00000000-0000-4000-8000-000000000304",
    "instrument_id": "00000000-0000-4000-8000-000000000004",
    "metric": "close",
    "value": "12.00",
    "unit": "USD",
    "feed": "fixture",
    "session": "regular",
    "adjustment": "none",
    "observed_at": "2026-09-24T20:00:00Z",
    "received_at": "2026-09-24T20:00:00Z"
  },
  {
    "id": "00000000-0000-4000-8000-000000000404",
    "instrument_id": "00000000-0000-4000-8000-000000000004",
    "metric": "close",
    "value": "12.01",
    "unit": "USD",
    "feed": "fixture",
    "session": "regular",
    "adjustment": "none",
    "observed_at": "2026-09-25T20:00:00Z",
    "received_at": "2026-09-25T20:00:00Z"
  }
]
